Company Name,Email ID,Address,Founder Name,CEO Name,Number of Branches,Locations,Year of Establishment
Tata Consultancy Services (TCS),contact@tcs.com,"TCS House, Mumbai, India",J.R.D. Tata,K. Krithivasan,150,46 countries,1968
Infosys,contact@infosys.com,"Electronics City, Bangalore, India",N.R. Narayana Murthy and others,Salil Parekh,50,Over 50 countries,1981
Alphabet Inc.,support@abc.xyz,"1600 Amphitheatre Parkway, Mountain View, CA, USA","Larry Page, Sergey Brin",Sundar Pichai,Multiple,Global operations,2015
Accenture,info@accenture.com,"1 Grand Canal Square, Dublin, Ireland",NA (Rebranded from Andersen Consulting),Julie Sweet,120,120+ countries,2001
Bosch,info@bosch.com,"Robert-Bosch-Platz 1, Gerlingen, Germany",Robert Bosch,Stefan Hartung,Global network,"Asia, Europe, Americas",1886
